Question,Answer
"In longer marathon races, such as the 5000m, how do athletes start the race?
A) In their own designated lanes
B) In a large pack at a start line
C) In a staggered formation
D) Individually at timed intervals",B
"In athletics, what does a green card indicate?
A) A player has committed a serious offence
B) The recall did not warrant a warning
C) The athlete has been disqualified
D) A new world record has been set",B
"In athletics, what does a diagonal red/black card signify?
A) The athlete has won the event
B) The athlete is given a warning
C) The athlete has made a false start
D) The athlete is disqualified for leaving the track",C
"How many yellow cards must an athlete receive before they are shown a red card and disqualified in athletics?
A) One
B) Two
C) Three
D) Four",B
"Which rider clinched the gold in the Long Jump competition with a distance of 6.10 meters?
A) Gian Giorgio Trissino
B) Dominique Gardere
C) Constant van Langendonck
D) M. de Bellegarde",C
"Who won the silver medal in the Long Jump competition, clearing 5.70 meters?
A) Dominique Gardere
B) Gian Giorgio Trissino
C) Constant van Langendonck
D) M. de Bellegarde",B
"In middle distance cycle sport, what is the typical starting gap between individual competitors?
A) 1 minute
B) 2 minutes
C) 3 minutes
D) 4 minutes",B
"In athletics, what does a green card indicate when used after a recall?
A) A false start
B) A warning
C) No warning is warranted
D) Disqualification",C
"Redgra surfaces are known to bind and solidify after a certain period. How long does it take for Redgra to solidify after being wet and compacted?
A) 12 hours
B) 24 hours
C) 48 hours
D) 72 hours",B
"What was the source location for the limestone and clay used in Redgra?
A) London
B) Forest of Dean, Gloucestershire
C) Harlow, Essex
D) Crystal Palace, London",B
"When was the Redgra area at Harlow Sportcentre opened?
A) March 1961
B) October 1961
C) 1964
D) It was not mentioned",B
"In athletics, what does a green card signify?
A) A severe penalty
B) A false start
C) That no warning is warranted
D) A personal record",C
"How wide is the board from which athletes jump?
A) 10 centimetres
B) 20 centimetres
C) 30 centimetres
D) 40 centimetres",B
"_________, such as Marita Koch, broke world records and were highly successful at international competitions due to the state-sponsored doping program in East Germany.
A) Coaches
B) Men
C) Women
D) Children",C
"Which region has not had a consistent indoor continental competition?
A) Europe
B) Asia
C) North America
D) Oceania",C
"What happens when a racewalking competitor receives three red cards?
A) They receive a warning.
B) They are given a time penalty.
C) They are disqualified.
D) They must restart the race.",C
"What happens when a competitor receives a yellow card from a judge in racewalking?
A) The competitor is given a warning for an infraction.
B) The competitor is immediately disqualified.
C) The competitor must pause for a time penalty.
D) The competitor's score is reduced.",A
"How many red cards from different judges will result in a competitor's disqualification in racewalking?
A) One
B) Two
C) Three
D) Four",C
"What does a red card signify in racewalking?
A) The competitor has shown unsporting behavior.
B) The competitor's foot was not on the ground when the rear leg was raised.
C) The competitor left the track.
D) The competitor's front leg was straightened before contact with the ground.",B
"How many red cards from different judges will disqualify a racewalker?
A) One
B) Two
C) Three
D) Four",C
"What happens when a racewalker commits their first infraction?
A) They are immediately disqualified.
B) They receive a red card.
C) They receive a yellow card.
D) They are given a warning.",C
"At the Olympics, which long-distance race is only available for women?
A) 800 meters
B) 1,500 meters
C) 1,000 meters
D) Both 800 meters and 1,500 meters",A
"A second false start by an athlete in the same event could lead to _______.
A) a time bonus
B) immediate disqualification
C) a financial reward
D) a mandatory timeout",B
"How were false starts handled between 2003 and 2009?
A) Immediate disqualification
B) A second chance without warnings
C) The whole field would be warned after the first false start
D) A time penalty was applied",C
"The IAAF rule about false starts is based on the premise that the human brain cannot process the information from the start sound in under how many seconds?
A) 0.05 seconds
B) 0.1 seconds
C) 0.08 seconds
D) 0.15 seconds",B
"If a player suddenly steps in front of a sprinting player, it is considered a violation because:
A) The sprinting player is invading the cylinder
B) The sprinting player has the ball
C) The player stepped in without giving time for reaction
D) The player stepped in with the ball",C
"In sports, a false start is typically penalized because it involves a movement by a participant before being _______ by the rules to start.
A) questioned
B) signaled
C) ignored
D) eliminated",B
"What term is used to describe a race that begins without any false starts?
A) A strong start
B) A fair start
C) A perfect start
D) A standard start",B
"How is a false start signalled to the athletes?
A) The starting gun is fired once
B) The starting gun is fired twice
C) A bell is rung
D) A whistle is blown",B
"Between 2003 and 2009, what would happen if there was a single false start?
A) The whole field would be disqualified
B) The original offender would be disqualified
C) The whole field would be warned
D) The race would continue without penalties",C
"What was a consequence of Redgra being improperly drained?
A) The surface became less prone to causing injuries.
B) The surface could become muddy.
C) There was an increase in red dust production.
D) The surface became similar to clay courts.",B
"Who decides whether it is practicable for athletes tying for first place in any final to compete again?
A) The chief photo finish judge
B) The head coach
C) The referee
D) The audience",C
"In the case of throws, the initiation line is in the shape of a(n) _______.
A) arc
B) straight line
C) zigzag
D) ellipse",A
"The trail leg should be tucked in horizontally and flat, close to the side of the hip to minimize _______.
A) speed
B) center-of-gravity deviation
C) energy
D) stride length",B
"As soon as the lead leg begins its descent, a strong downward push is exerted to enable the trailing leg's knee to come up under the armpit and in front of the _______.
A) head
B) chest
C) back
D) shoulder",B
"The objective of tucking the trail leg in horizontally and flat is to minimize _______ from normal sprinting.
A) deviation of center-of-gravity
B) air resistance
C) speed
D) energy consumption",A
"The trailing leg's knee coming up under the armpit and in front of the chest enables the recovery of some of the _______ expended in the flight.
A) energy
B) speed
C) balance
D) momentum",A
"The vaulter pushes off the pole and releases it so that the pole falls away from the __________ and mats.
A) vaulter
B) crossbar
C) landing area
D) spectators",B
"If a vaulter passes after one miss at a height, how many attempts do they have at the next height?
A) One
B) Two
C) Three
D) Four",B
"The process of manufacturing glass fiber vaulting poles starts with a metal tube known as a _______.
A) mandrel
B) spindle
C) cylinder
D) rod",A
"What material is added to E-glass and S-glass to create a lighter pole vaulting pole?
A) Steel
B) Ash
C) Carbon fiber
D) Rubber",C
"What was the world record height set by Michael Sweeney in 1895?
A) 1.97 m
B) 2.01 m
C) 1.95 m
D) 2.03 m",A
"In racewalking, what does a red card signify?
A) The competitor has made a false start.
B) The competitor's foot failed to be on the ground when the rear leg is being raised.
C) The competitor has left the designated race track.
D) The competitor has finished the race.",B
"What happens when a racewalking competitor receives a red card from the same judge for the second infraction?
A) They receive a warning.
B) They are immediately disqualified.
C) They are given a yellow card.
D) They are issued a red card.",D
"How many red cards from different judges will result in a racewalking competitor's disqualification?
A) One
B) Two
C) Three
D) Four",C
"In racewalking, what does a red card signify?
A) The competitor has started running.
B) The competitor's foot failed to be on the ground when the rear leg is being raised, or the front leg is not straightened when it makes contact with the ground.
C) The competitor has left the designated track.
D) The competitor has used unauthorized equipment.",B
"How does a racewalking judge respond to the first infraction committed by a competitor?
A) A red card is issued immediately.
B) A yellow card is issued as a warning.
C) The competitor is disqualified.
D) The judge verbally warns the competitor.",B
"What is an example of specific preparation for an endurance athlete?
A) Taking a complete break from training
B) Running on a treadmill
C) Transitioning from treadmill running to pavement running
D) Learning about the history of the sport",C
"The hollowed out muscles on the supporting limb work to prevent the hip from adducting during the swing stages. 
A) Psoas and quadriceps
B) Hamstrings and gastrocnemius
C) Gluteus medius and psoas
D) Rectus femoris and vastus medialis",C
"In which stages does the gastrocnemius exhibit the greatest muscle activity in the supporting limb?
A) Stages 1 and 2
B) Stages 2 and 3
C) Stages 3 and 4
D) Stages 4 and 5",C
"In running, the arms move in a __________ motion in relation to the trunk, which is different from the movement in the overhead press exercise.
A) sideways
B) forward-backward
C) circular
D) upward-downward",B
"When an exercise mimics a movement pattern that occurs during a run or sports skill, it is known as a ________.
A) generalized exercise
B) specialized exercise
C) standard exercise
D) random exercise",B
"What did the organizers use to provide light for the athletes as it began to get dark?
A) Flashlights
B) Streetlights
C) Headlights from cars
D) Bonfires",C
"How many Olympic records were broken during the Beijing Olympic Games?
A) 66
B) 70
C) 5
D) 0",A
"Just prior to the swing phase, the athlete should land on the supporting leg with the knee slightly _______ to absorb some of the impact.
A) extended
B) flexed
C) locked
D) rotated",B
"According to the IAAF, an athlete is considered to have false-started if they move within how many seconds after the gun has fired?
A) 0.05 seconds
B) 0.1 seconds
C) 0.08 seconds
D) 0.15 seconds",B
"How is a false start signalled to the athletes?
A) By waving a red flag
B) By firing the starting gun once
C) By firing the starting gun twice
D) By sounding a buzzer",C
"Prior to 2003, how many false starts were athletes allowed before being disqualified?
A) None
B) One
C) Two
D) Three",B
"What reaction time did male sprinters achieve in one out of 1,000 starts at the 2008 Beijing Olympics?
A) 0.109 s
B) 0.121 s
C) 0.08 s
D) 0.1 s",A
"What did the analysis of the 2008 Beijing Olympics suggest about the starting block force threshold?
A) It should be the same for both sexes
B) It should be increased for males
C) It should be reduced for females
D) It does not affect reaction times",C
"What is the reason for suggesting a reduction in the starting block force threshold for females?
A) To increase the number of false starts
B) To account for the lower rate of developing muscle strength
C) To shorten the reaction times
D) To make the starts faster",B
"According to the IAAF-commissioned study, top sprinters are able to sometimes react in how many seconds?
A) 0.05 seconds
B) 0.1 seconds
C) 0.08 seconds
D) 0.15 seconds",C
"What did the analysis of female sprinters' start times at the 2008 Beijing Olympics show?
A) They had more false starts than males
B) They had fewer false starts than males
C) They had the same number of false starts as males
D) Their reaction times were not measurable",B
"In athletics, what does a red card signify for an athlete?
A) The athlete has won the event
B) The athlete is given a warning
C) The athlete is disqualified after receiving two yellow cards
D) The athlete is allowed to have a re-start",C
"What type of card is issued to an athlete for committing a false start in athletics?
A) A green card
B) A diagonal red/black card
C) A yellow card
D) A blue card",B
"How does a competitor in a cycle sport relay know when it's their turn to race?
A) When the previous competitor rings a bell
B) When the previous competitor crosses the finish line and touches them
C) When the team coach signals them
D) When the previous competitor shouts their name",B
"According to the IAAF rules, an athlete is considered to have false-started if they move within how many seconds after the gun has fired?
A) 0.05 seconds
B) 0.08 seconds
C) 0.10 seconds
D) 0.12 seconds",C
"A study commissioned by the IAAF in 2009 found that top sprinters can sometimes react in how many seconds?
A) 0.05 seconds
B) 0.08 seconds
C) 0.10 seconds
D) 0.12 seconds",B
"At which type of meets is the false start rule with automated devices applied?
A) Only at local meets
B) Only at high-level meets
C) At all meets
D) At international meets only",B
"What was the penalty for an athlete committing a false start before 2003?
A) Immediate disqualification
B) A warning for the entire field
C) Allowed another start
D) A time penalty",C
"After how many false starts would an athlete be disqualified between 2003 and 2009?
A) One
B) Two
C) Three
D) Four",B
"What was the reaction time achieved by sprinters at the 2008 Beijing Olympics?
A) 0.109 s for males and 0.121 s for females
B) 0.121 s for males and 0.109 s for females
C) 0.100 s for both males and females
D) 0.080 s for both males and females",A
"According to the analysis, what could reduce the number of false starts among female sprinters?
A) Increasing the force threshold
B) Reducing the force threshold by 22%
C) Using separate starting blocks
D) Allowing a longer reaction time",B
"What is the suggested reason for fewer false starts among women sprinters?
A) Higher concentration levels
B) Lower rate of developing muscle strength
C) Faster reaction times
D) Different starting techniques",B
"What would be the expected outcome if the force threshold for starting blocks was reduced for females?
A) Increase in male false starts
B) No change in reaction times or false starts
C) Males and females would exhibit similar reaction times and numbers of false starts
D) A significant increase in female false starts",C
"Since what year are athletes immediately disqualified for a false start?
A) 2003
B) 2009
C) 2008
D) 2010",B
"What does a red card signify in athletics?
A) The athlete has won the event
B) The athlete is given a warning
C) The athlete is disqualified after receiving two yellow cards
D) The athlete is allowed to have a do-over",C
"What type of card is issued for a false start in athletics?
A) A yellow card
B) A red card
C) A green card
D) A diagonal red/black card",D
"In track and field, a stutter step is commonly associated with events where __________.
A) endurance is key
B) precision in foot placement is crucial
C) sprinting speed is the primary focus
D) team coordination is necessary",B
"The purpose of a stutter step in track and field is to __________.
A) increase the athlete's speed before a jump
B) make shortened adjustment steps for precise actions
C) distract the competitors during a race
D) prepare for a long-distance run",B
"What does a red card signify in athletics?
A) The athlete has won the event
B) The athlete is given a warning
C) The athlete is disqualified after receiving two yellow cards
D) The athlete is allowed to have a re-start",C
"What type of card is issued for a false start in athletics?
A) A yellow card
B) A red card
C) A green card
D) A diagonal red/black card",D
"What negative effect does taking off from the board heel-first have?
A) It increases the jump's height
B) It creates a more powerful takeoff
C) It has a braking effect, decreasing velocity
D) It enhances the athlete's stability",C
"Jumping off the toes during the takeoff can put the leg at risk of what?
A) Gaining extra distance
B) Increased velocity
C) Buckling or collapsing
D) Generating too much height",C
"What is the purpose of keeping the torso upright and moving the hips forward and up during takeoff?
A) To decrease the jump's distance
B) To achieve the maximum distance from board contact to foot release
C) To prepare for the landing phase
D) To increase the time spent in the air",B
"Which of the following is NOT one of the four main styles of takeoff in long jump?
A) The kick style
B) The double-arm style
C) The sprint takeoff
D) The roll-over style",D
"What is the objective of the takeoff in long jump?
A) To create a horizontal impulse through the athlete's center of gravity
B) To create a vertical impulse through the athlete's center of gravity
C) To prepare the athlete for the landing phase
D) To maximize the time the athlete spends in the air",B
"In track and field, the sprint takeoff is a technique that is most commonly taught by coaches. Which of the following best describes this takeoff style?
A) A double-arm action that mimics a crouching position
B) A classic single-arm action that resembles a jumper in full stride
C) A passive leg swing that minimizes air resistance
D) An aggressive two-footed jump to maximize height",B
"What is the primary advantage of using the sprint takeoff style in track and field?
A) It allows for a faster start from the blocks
B) It helps in conserving energy for the final sprint
C) It is an efficient takeoff style for maintaining velocity through takeoff
D) It increases the chance of a false start, thus disqualifying competitors",C
"In the long jump, which component is crucial for a successful takeoff and is also a fundamental aspect where many athletes also compete in other events?
A) The approach run
B) The last two strides
C) Action in the air
D) Landing",A
"Which two athletes are classic examples of competitors who have excelled in both the long jump and sprints?
A) Carl Lewis and Heike Drechsler
B) Usain Bolt and Florence Griffith-Joyner
C) Mike Powell and Marion Jones
D) Jesse Owens and Allyson Felix",A
"What are the two fundamental aspects of success in the long jump, as mentioned in the content?
A) Speed in the run-up and a strong arm swing
B) High leap off the board and precise timing
C) Speed in the run-up and a high leap off the board
D) Perfect landing and action in the air",C
"The primary goal of the approach in long jump is to _______.
A) maintain a steady pace throughout
B) gradually accelerate to a maximum controlled speed at takeoff
C) focus on jumping at a high angle
D) ensure the longest possible approach",B
"What is the most important factor for the distance travelled by an object in long jump?
A) The length of the approach
B) The angle of takeoff
C) The velocity at takeoff
D) The number of steps in the approach",C
"Elite jumpers usually leave the ground at an angle of _______.
A) forty-five degrees
B) twenty degrees or less
C) thirty degrees
D) fifty degrees",B
"For a jumper, it is more beneficial to focus on the _______ component of the jump.
A) angle
B) speed
C) height
D) strength",B
"The length of the approach for an elite level jumper is typically between _______ steps.
A) 12 and 19
B) 15 and 18
C) 20 and 22
D) 10 and 15",C
"The exact distance and number of steps in an approach depends on the jumper's _______.
A) preference for the type of jump
B) experience, sprinting technique, and conditioning level
C) choice of footwear
D) weather conditions on the day of the event",B
"Consistency in the approach is important because it helps the competitor to _______.
A) finish the jump with a flourish
B) get as close to the front of the takeoff board as possible without crossing the line
C) impress the judges
D) prepare for the landing phase",B
"In the long jump event, athletes must combine speed, strength, and agility to leap as far as possible from a ________.
A) starting line
B) takeoff point
C) finish line
D) hurdle mark",B
"The long jump and triple jump are grouped together in track and field because both events measure ________.
A) height
B) distance
C) speed
D) endurance",B
"The long jump has been an Olympic event for women since ________.
A) 1896
B) 1928
C) 1948
D) 1960",C
"In the power sprint takeoff, what is the major difference from the sprint style regarding the position of the arms?
A) The arm on the side of the takeoff leg remains bent.
B) Both arms remain bent at all times.
C) The arm on the side of the takeoff leg fully extends backward.
D) Both arms fully extend forward.",C
"What does the additional extension of the arm on the side of the takeoff leg during a power sprint takeoff increase?
A) The accuracy of the jump.
B) The impulse at takeoff.
C) The speed of the sprinter.
D) The endurance of the athlete.",B
"According to the content, how is the ""correct"" style of takeoff determined in power sprinting?
A) It is the same for all athletes.
B) It is based on the coach's preference.
C) It varies from athlete to athlete.
D) It is determined by the length of the sprint.",C
"The runway used for jumping is usually coated with what type of surface?
A) Concrete
B) Grass
C) Rubberized
D) Sand",C
"What happens if a competitor's foot crosses the foul line before the jump?
A) The jump is measured from the foul line
B) The jump is declared a foul
C) The competitor gets a second chance
D) The jump is measured with a penalty",B
"What is used to detect a foul jump at elite competitions?
A) A referee's decision
B) A tape measure
C) High-speed cameras
D) An electronic sensor",C
"What is the maximum number of attempts a competitor normally has in the trial rounds?
A) Two
B) Three
C) Four
D) Five",B
"How many additional jumps are awarded to the best competitors after the trial rounds?
A) One
B) Two
C) Three
D) Four",C
"What is the maximum accepted wind assistance for record purposes?
A) 1 m/s
B) 2 m/s
C) 3 m/s
D) 4 m/s",B
"In the event of a tie, how is the winner determined?
A) Coin toss
B) Jump-off
C) Comparing the next best jumps
D) Athlete with the least fouls",C
"What do competitors use along the side of the runway to assist their jump?
A) Flags
B) Cones
C) Marks
D) Lights",C
"What is the width of the wooden or synthetic board that athletes jump from?
A) 6 inches
B) 8 inches
C) 10 inches
D) 12 inches",B
"What determines the number of additional jumps in the final rounds?
A) The number of competitors
B) The number of lanes on the track
C) The athlete's personal best
D) The weather conditions",B
"What are the three major flight techniques for the long jump?
A) The hang, the sail, and the hitch-kick
B) The dive, the roll, and the twist
C) The leap, the bound, and the hop
D) The skip, the jump, and the land",A
"Why were the flight techniques for the long jump developed?
A) To increase the speed of the runner
B) To combat the forward rotation experienced from take-off
C) To change the direction they are traveling in the air
D) To ensure a perfect landing posture",B
"What is the consequence of an athlete not landing correctly balanced?
A) A higher distance will be measured
B) A lower distance will be measured
C) The jump will be disqualified
D) The technique will be reconsidered",B
"Once the body is airborne in the long jump, what can the athlete do to change the direction they are traveling?
A) They can twist their body
B) They can change their leg position
C) There is nothing they can do
D) They can adjust their arm position",C
"The first men's long jump world record recognized by the IAAF in 1912 was a jump of ________ by Peter O'Connor.
A) 7.61 m
B) 8.13 m
C) 8.90 m
D) 8.95 m",A
"Jesse Owens' long jump world record, set in 1935, lasted for how many years?
A) 20 years
B) 25 years
C) 32 years
D) 55 years",B
"Bob Beamon's Olympic record jump at the 1968 Summer Olympics was ________.
A) 8.13 m
B) 8.90 m
C) 8.95 m
D) 7.61 m",B
"Mike Powell's current men's world record in long jump stands at ________.
A) 8.99 m
B) 8.96 m
C) 8.95 m
D) 8.91 m",C
"Carl Lewis' wind-assisted jump, which did not count as a world record, was ________.
A) 8.90 m
B) 8.95 m
C) 8.91 m
D) 8.99 m",C
"Fanny Blankers-Koen held the women's long jump world record for over ________ during World War II.
A) 10 years
B) 20 years
C) 25 years
D) 35 years",A
"The altitude at which Bob Beamon set his record jump in 1968 was ________.
A) 2,292 m
B) 1,500 m
C) 1,000 m
D) 3,000 m",A
"The men's long jump world record set by Mike Powell has now stood for over ________ years.
A) 20
B) 25
C) 32
D) 55",C
"The jump by Iván Pedroso, which was not validated as a world record, was ________.
A) 8.95 m
B) 8.96 m
C) 8.99 m
D) 8.91 m",B
"The prize Iván Pedroso missed out on due to his invalidated jump was ________.
A) $100,000
B) $130,000
C) A Ferrari
D) Both B and C",D
"The longest jump ever not to win an Olympic or World Championship gold medal was ________.
A) 8.99 m
B) 8.96 m
C) 8.95 m
D) 8.91 m",D
"How many times was the men's long jump world record exchanged between Boston and Ter-Ovanesyan?
A) Three times
B) Five times
C) Four times
D) Six times",A
"The women's long jump world record has been improved upon twice in the same competition on ________ occasions.
A) Two
B) Three
C) Four
D) Five",C
"The men's long jump world record held by Jesse Owens was set at the ________.
A) Olympic Games
B) IAAF World Championships
C) Big Ten track meet
D) NCAA Championships",C
"The women's world record has stood longer than any other long jump world record by men or women, lasting over ________ years.
A) 25
B) 32
C) 35
D) 55",C
"In the last two steps before takeoff in track and field, what is the objective of the penultimate step?
A) To increase speed
B) To prepare the body for the vertical impulse
C) To raise the center of gravity
D) To complete the jump",B
